operation,avg_time_ms,stddev_ms,num_records,query
Select all users,0.18606185913085938,0.1425208355061179,5,SELECT * FROM users WHERE id BETWEEN 1 AND 100
Select all products in category,0.4408836364746094,0.474146955130208,5,SELECT * FROM products WHERE category = %s AND id BETWEEN 1 AND 100
Select all orders for user,0.24499893188476562,0.14503892044730726,5,SELECT * FROM orders WHERE user_id = %s AND id BETWEEN 1 AND 100
Top 10 best-selling products,3.0111312866210938,0.8583927873168684,5,"SELECT product_id, COUNT(*) as cnt FROM order_reviews GROUP BY product_id ORDER BY cnt DESC LIMIT 10"
Average rating per product,1.8256187438964844,0.17230764897584158,5,"SELECT product_id, AVG(rating) FROM order_reviews GROUP BY product_id LIMIT 10"
