operation,avg_time_ms,stddev_ms,num_records,query
Select all users,266.4524555206299,1.7771160942388338,5,SELECT * FROM users WHERE id BETWEEN 1 AND 1000000
Select all products in category,31.617450714111328,6.615668134337359,5,SELECT * FROM products WHERE category = %s AND id BETWEEN 1 AND 1000000
Select all orders for user,26.065397262573242,6.007965822612009,5,SELECT * FROM orders WHERE user_id = %s AND id BETWEEN 1 AND 1000000
Top 10 best-selling products,149.85957145690918,10.926295406445082,5,"SELECT product_id, COUNT(*) as cnt FROM order_reviews GROUP BY product_id ORDER BY cnt DESC LIMIT 10"
Average rating per product,48.3241081237793,1.5257837873107327,5,"SELECT product_id, AVG(rating) FROM order_reviews GROUP BY product_id LIMIT 10"
