operation,avg_time_ms,stddev_ms,num_records,query
Select all users,2.5299549102783203,0.32327434412292605,5,SELECT * FROM users WHERE id BETWEEN 1 AND 10000
Select all products in category,1.8236637115478516,0.5829899317808511,5,SELECT * FROM products WHERE category = %s AND id BETWEEN 1 AND 10000
Select all orders for user,0.6602764129638672,0.3160641195583136,5,SELECT * FROM orders WHERE user_id = %s AND id BETWEEN 1 AND 10000
Top 10 best-selling products,151.8207550048828,9.634220917195258,5,"SELECT product_id, COUNT(*) as cnt FROM order_reviews GROUP BY product_id ORDER BY cnt DESC LIMIT 10"
Average rating per product,50.09751319885254,2.7434660420921975,5,"SELECT product_id, AVG(rating) FROM order_reviews GROUP BY product_id LIMIT 10"
