operation,avg_time_ms,stddev_ms,num_records,query
Select all users,10.741901397705078,2.6512308804180225,5,SELECT * FROM users WHERE id BETWEEN 1 AND 30000
Select all products in category,1.2969970703125,0.04592730304924766,5,SELECT * FROM products WHERE category = %s AND id BETWEEN 1 AND 30000
Select all orders for user,3.5194873809814453,1.1160801315182833,5,SELECT * FROM orders WHERE user_id = %s AND id BETWEEN 1 AND 30000
Top 10 best-selling products,3.135204315185547,0.7302147492048363,5,"SELECT product_id, COUNT(*) as cnt FROM order_reviews GROUP BY product_id ORDER BY cnt DESC LIMIT 10"
Average rating per product,2.427387237548828,0.16564236093579623,5,"SELECT product_id, AVG(rating) FROM order_reviews GROUP BY product_id LIMIT 10"
